<!ELEMENT jornadas (partido+)>
<!ELEMENT partido (NUM_JORNADA,HORA,RESULTADOL,RESULTADOV,ID_EQUIPOL,ID_EQUIPOV)>
<!ELEMENT NUM_JORNADA (#PCDATA)>
<!ELEMENT HORA (#PCDATA)>
<!ELEMENT RESULTADOL (#PCDATA)>
<!ELEMENT RESULTADOV (#PCDATA)>
<!ELEMENT ID_EQUIPOL (#PCDATA)>
<!ELEMENT ID_EQUIPOV (#PCDATA)>